<?xml version="1.0" encoding="utf-8"?>
<?xml-stylesheet type="text/xsl" href="example.xsl"?>
<project xmlns:xsi="http://www.w3.org/2001/XMLSchema-instance" xsi:noNamespaceSchemaLocation="example-schema.xsd" xmlns:xlink="http://www.w3.org/1999/xlink">
  <unit>
    <name>SYSTEM NAME</name>
    <description>
      <abstract>
    Very brief description of the system.
    </abstract>
      <long_description/>
      <what>
    Specific short description of what the system does, 100 words limited.
    </what>
      <why>
    Specific short description of why the system is used/ what problem it solves and how much it might reduce costs, 100 words limited.
    </why>
      <how>
     Specific short description of how the functionality is achieved or one can reproduce it, 100 words limited.
    </how>
      <tags>
        <tag>Tag1</tag>
        <tag>Tag2</tag>
        <tag>Tag3</tag>
      </tags>
    </description>
    <video>
      <description>Intro video</description>
      <url>http://www.youtube.com/embed/yq6hBNCzH10</url>
    </video>
    <image/>
    <logic_parts>
      <logic_part>
        <name>Logic part 1</name>
        <description>Destcription of first logic part of the system.</description>
        <quantity>3</quantity>
        <image/>
        <designator>Designator for Logic part 1.</designator>
        <digital_part>
          <file>example.txt</file>
          <url>http://www.irnas.eu</url>
          <parameters>example.txt</parameters>
        </digital_part>
        <physical_part_tags>
          <part_tag>physical_part1</part_tag>
          <part_tag>physical_part2</part_tag>
        </physical_part_tags>
        <logic_part_tag>logic_part1</logic_part_tag>
      </logic_part>
      <logic_part>
        <name>Logic part 2</name>
        <description>Destcription of the second logic part of the system.</description>
        <quantity>10</quantity>
        <image/>
        <designator>Designator for Logic part 2.</designator>
        <digital_part>
          <file>example.txt</file>
          <url>http://www.irnas.eu</url>
          <parameters>example.txt</parameters>
        </digital_part>
        <physical_part_tags>
          <part_tag>physical_part1</part_tag>
          <part_tag>physical_part2</part_tag>
        </physical_part_tags>
        <logic_part_tag>logic_part2</logic_part_tag>
      </logic_part>
    </logic_parts>
    <assembly_instruction>
      <step>
        <description>Step 1 instructions for the whole system.</description>
        <image>img/img1.jpg</image>
        <video/>
        <logic_part_tags>
          <part_tag>logic_part1</part_tag>
          <part_tag>logic_part2</part_tag>
        </logic_part_tags>
      </step>
      <step>
        <description>Step 2 instructions for the whole system.</description>
        <image>img/img1.jpg</image>
        <video/>
        <logic_part_tags>
          <part_tag>logic_part1</part_tag>
          <part_tag>logic_part2</part_tag>
        </logic_part_tags>
      </step>
    </assembly_instruction>
    <test_instruction>
      <step>
        <description>Step 1 instructions on how to test the whole system.</description>
        <image>img/img1.jpg</image>
        <video/>
        <logic_part_tags>
          <part_tag>logic_part1</part_tag>
          <part_tag>logic_part2</part_tag>
        </logic_part_tags>
      </step>
      <step>
        <description>Step 2 instructions on how to test the whole system.</description>
        <image>img/img1.jpg</image>
        <video/>
        <logic_part_tags>
          <part_tag>logic_part1</part_tag>
          <part_tag>logic_part2</part_tag>
        </logic_part_tags>
      </step>
    </test_instruction>
    <user_manual>
      <step>
        <description>Step 1 in user manual on how to use the whole system.</description>
        <image>img/img1.jpg</image>
        <video/>
        <logic_part_tags>
          <part_tag>logic_part1</part_tag>
          <part_tag>logic_part2</part_tag>
        </logic_part_tags>
      </step>
      <step>
        <description>Step 2 in user manual on how to use the whole system.</description>
        <image>img/img1.jpg</image>
        <video/>
        <logic_part_tags>
          <part_tag>logic_part1</part_tag>
          <part_tag>logic_part2</part_tag>
        </logic_part_tags>
      </step>
    </user_manual>
    <licensing>
      <description>Licensing for the whole system.</description>
      <file>example.txt</file>
      <url>http://www.irnas.eu</url>
    </licensing>
    <safety>
      <description>Safety for the whole system.</description>
      <file>example.txt</file>
      <url>http://www.irnas.eu</url>
    </safety>
    
    <children>
      <unit order="1">
        <name> UNIT1</name>
        <description>
          <abstract>
            Very brief description of the first unit (module).
            </abstract>
          <long_description>
           Description of the first unit (module).
          </long_description>
          <what>
            Specific short description of what the unit 1 does, 100 words limited.
            </what>
          <why>
            Specific short description of why the unit 1 is used/ what problem it solves and how much it might reduce costs, 100 words limited.
            </why>
          <how>
             Specific short description of how the functionality is achieved or one can reproduce it, 100 words limited.
            </how>
          <tags>
            <tag>Tag1</tag>
            <tag>Tag2</tag>
            <tag>Tag3</tag>
          </tags>
        </description>
         <video>
      <description>Intro video</description>
      <url>http://www.youtube.com/embed/yq6hBNCzH10</url>
    </video>
        <image>img1.jpg</image>
        <logic_parts>
          <logic_part>
            <name>Logic part 3</name>
            <description>Destcription of first logic part of the unit 1.</description>
            <quantity>3</quantity>
            <image/>
            <designator>Designator for Logic part 3.</designator>
            <digital_part>
              <file>example.txt</file>
              <url>http://www.irnas.eu</url>
              <parameters>example.txt</parameters>
            </digital_part>
            <physical_part_tags>
              <part_tag>physical_part1</part_tag>
              <part_tag>physical_part2</part_tag>
            </physical_part_tags>
            <logic_part_tag>logic_part3</logic_part_tag>
          </logic_part>
          <logic_part>
            <name>Logic part 4</name>
            <description>Destcription of the second logic part of the unit 1.</description>
            <quantity>10</quantity>
            <image/>
            <designator>Designator for Logic part 4.</designator>
            <digital_part>
              <file>example.txt</file>
              <url>http://www.irnas.eu</url>
              <parameters>example.txt</parameters>
            </digital_part>
            <physical_part_tags>
              <part_tag>physical_part1</part_tag>
              <part_tag>physical_part2</part_tag>
            </physical_part_tags>
            <logic_part_tag>logic_part4</logic_part_tag>
          </logic_part>
        </logic_parts>
        <assembly_instruction>
          <step>
            <description>Step 1 instructions for the unit 1.</description>
            <image>img/img1.jpg</image>
            <video/>
            <logic_part_tags>
              <part_tag>logic_part1</part_tag>
              <part_tag>logic_part2</part_tag>
            </logic_part_tags>
          </step>
          <step>
            <description>Step 2 instructions for the unit 1.</description>
           <image>img/img1.jpg</image>
            <video/>
            <logic_part_tags>
              <part_tag>logic_part1</part_tag>
              <part_tag>logic_part2</part_tag>
            </logic_part_tags>
          </step>
        </assembly_instruction>
        <test_instruction>
          <step>
            <description>Step 1 instructions on how to test the unit 1.</description>
            <image>img/img1.jpg</image>
            <video/>
            <logic_part_tags>
              <part_tag>logic_part1</part_tag>
              <part_tag>logic_part2</part_tag>
            </logic_part_tags>
          </step>
          <step>
            <description>Step 2 instructions on how to test the unit 1.</description>
            <image>img/img1.jpg</image>
            <video/>
            <logic_part_tags>
              <part_tag>logic_part1</part_tag>
              <part_tag>logic_part2</part_tag>
            </logic_part_tags>
          </step>
        </test_instruction>
        <user_manual>
          <step>
            <description>Step 1 in user manual on how to use unit 1.</description>
            <image>img/img1.jpg</image>
            <video/>
            <logic_part_tags>
              <part_tag>logic_part1</part_tag>
              <part_tag>logic_part2</part_tag>
            </logic_part_tags>
          </step>
          <step>
            <description>Step 2 in user manual on how to unit 1.</description>
            <image>img/img1.jpg</image>
            <video/>
            <logic_part_tags>
              <part_tag>logic_part1</part_tag>
              <part_tag>logic_part2</part_tag>
            </logic_part_tags>
          </step>
        </user_manual>
        <licensing>
          <description>Licensing for the unit 1.</description>
          <file>example.txt</file>
          <url>http://www.irnas.eu</url>
        </licensing>
        <safety>
          <description>Safety for the unit 1.</description>
          <file>example.txt</file>
          <url>http://www.irnas.eu</url>
        </safety>
        
        <children>
            <unit order="1">
                <name> UNIT1a</name>
                <description>
                  <abstract>
                    Very brief description of the first sub-unit (module).
                    </abstract>